"Status","Start Time","Stop Time","Duration in ms","Parent Suite","Suite","Sub Suite","Test Class","Test Method","Name","Description"
"passed","Mon Jul 14 12:35:40 GMT 2025","Mon Jul 14 12:35:41 GMT 2025","907","tests.test_backend.document.access_doc","test_duplicate_doc_access_by_roles","","","","Дублирование Personal-документа: создание owner, дублирование member",""
"passed","Mon Jul 14 12:34:18 GMT 2025","Mon Jul 14 12:34:18 GMT 2025","303","tests.test_backend.board","board_validation_test","","","","APP-2763: Ошибка при создании борды с длинным заголовком custom field: Text",""
"passed","Mon Jul 14 12:36:41 GMT 2025","Mon Jul 14 12:36:42 GMT 2025","893","tests.test_backend.document.access_doc","test_edit_doc_access_by_roles","","","","Редактирование Personal-документа: создание owner, редактирование manager",""
"passed","Mon Jul 14 12:35:37 GMT 2025","Mon Jul 14 12:35:38 GMT 2025","882","tests.test_backend.document.access_doc","test_duplicate_doc_access_by_roles","","","","Дублирование Space-документа: создание member, дублирование guest",""
"passed","Mon Jul 14 12:34:53 GMT 2025","Mon Jul 14 12:34:54 GMT 2025","726","tests.test_backend.document.access_doc","test_create_doc_access_by_roles","","","","Создание Project-документа для роли manager",""
"passed","Mon Jul 14 12:34:28 GMT 2025","Mon Jul 14 12:34:29 GMT 2025","285","tests.test_backend.board","test_board","","","","Создание кастомного поля типа: Number",""
"passed","Mon Jul 14 12:39:03 GMT 2025","Mon Jul 14 12:39:05 GMT 2025","1779","tests.test_backend.document","test_get_siblings","","","","Проверка отсутствия siblins и родителей для одного корневого документа (kind=Project)","Тест проверки siblins и родителей для родительского документа"
"passed","Mon Jul 14 12:39:45 GMT 2025","Mon Jul 14 12:39:47 GMT 2025","2225","tests.test_backend.document","test_get_siblings","","","","Проверяем siblins для нескольктих Child (kind=Space)",""
"passed","Mon Jul 14 12:36:50 GMT 2025","Mon Jul 14 12:36:51 GMT 2025","1155","tests.test_backend.document.access_doc","test_edit_doc_access_by_roles","","","","Редактирование Personal-документа: создание member, редактирование member",""
"skipped","Mon Jul 14 12:37:35 GMT 2025","Mon Jul 14 12:37:35 GMT 2025","0","tests.test_backend.document","test_create_document","","","","test_document_index_validation[zero]",""
"passed","Mon Jul 14 12:39:33 GMT 2025","Mon Jul 14 12:39:36 GMT 2025","2697","tests.test_backend.document","test_get_siblings","","","","Проверяем siblins для единственного SoloChild (kind=Project)","
    Единственный ребёнок: нет prevSibling/nextSibling, parents содержит родителя.
    "
"passed","Mon Jul 14 12:39:42 GMT 2025","Mon Jul 14 12:39:45 GMT 2025","2268","tests.test_backend.document","test_get_siblings","","","","Проверяем siblins для нескольктих Child (kind=Project)",""
"passed","Mon Jul 14 12:39:57 GMT 2025","Mon Jul 14 12:39:58 GMT 2025","736","tests.test_backend.document","test_get_siblings","","","","Негативный: некорректный document_id=notAnObjectId1234567890","
    Негативные сценарии: разные варианты некорректного document_id.
    "
"passed","Mon Jul 14 12:38:36 GMT 2025","Mon Jul 14 12:38:38 GMT 2025","1941","tests.test_backend.document","test_get_documents","","","","Получение документов — кейс: kind=Space",""
"passed","Mon Jul 14 12:40:20 GMT 2025","Mon Jul 14 12:40:20 GMT 2025","338","tests.test_backend.project","test_project","","","","Создание проекта с пустым описанием",""
"passed","Mon Jul 14 12:40:14 GMT 2025","Mon Jul 14 12:40:14 GMT 2025","269","tests.test_backend.document","test_get_y_document","","","","Негативный экспорт Y-Doc для document_id=","
    Негативный сценарий: разные некорректные document_id.
    "
"passed","Mon Jul 14 12:34:19 GMT 2025","Mon Jul 14 12:34:20 GMT 2025","356","tests.test_backend.board","board_validation_test","","","","APP-2763: Ошибка при создании борды с длинным заголовком custom field: Member",""
"passed","Mon Jul 14 12:35:11 GMT 2025","Mon Jul 14 12:35:13 GMT 2025","1620","tests.test_backend.document.access_doc","test_duplicate_doc_access_by_roles","","","","Дублирование Project-документа: создание manager, дублирование manager",""
"skipped","Mon Jul 14 12:37:35 GMT 2025","Mon Jul 14 12:37:35 GMT 2025","0","tests.test_backend.document","test_create_document","","","","test_document_index_validation[negative]",""
"passed","Mon Jul 14 12:34:20 GMT 2025","Mon Jul 14 12:34:20 GMT 2025","272","tests.test_backend.board","board_validation_test","","","","APP-2763: Ошибка при создании борды с длинным заголовком custom field: TaskRelations",""
"passed","Mon Jul 14 12:35:17 GMT 2025","Mon Jul 14 12:35:19 GMT 2025","1543","tests.test_backend.document.access_doc","test_duplicate_doc_access_by_roles","","","","Дублирование Project-документа: создание member, дублирование manager",""
"passed","Mon Jul 14 12:34:29 GMT 2025","Mon Jul 14 12:34:30 GMT 2025","388","tests.test_backend.board","test_board","","","","Создание кастомного поля типа: Date",""
"passed","Mon Jul 14 12:37:56 GMT 2025","Mon Jul 14 12:37:56 GMT 2025","227","tests.test_backend.document","test_duplicate_document","","","","Авторизован, но не участник пространства — дублирование запрещено Member",""
"passed","Mon Jul 14 12:37:28 GMT 2025","Mon Jul 14 12:37:29 GMT 2025","718","tests.test_backend.document","test_create_document","","","","Создание документа: Project",""
"passed","Mon Jul 14 12:37:43 GMT 2025","Mon Jul 14 12:37:44 GMT 2025","774","tests.test_backend.document","test_duplicate_document","","","","Создание и дублирование документа (Member)",""
"skipped","Mon Jul 14 12:37:35 GMT 2025","Mon Jul 14 12:37:35 GMT 2025","0","tests.test_backend.document","test_create_document","","","","test_document_parent_validation[nonexistent]",""
"passed","Mon Jul 14 12:37:35 GMT 2025","Mon Jul 14 12:37:35 GMT 2025","382","tests.test_backend.document","test_create_document","","","","Создание документа - кейс с kind=Project и kindId (ожидается 200)",""
"passed","Mon Jul 14 12:34:43 GMT 2025","Mon Jul 14 12:34:44 GMT 2025","717","tests.test_backend.document.access_doc","test_archive_doc","","","","Архивирование Project-документа для роли owner",""
"passed","Mon Jul 14 12:37:58 GMT 2025","Mon Jul 14 12:37:59 GMT 2025","286","tests.test_backend.document","test_edit_document","","","","Успешное редактирование полей title и icon. Member",""
"passed","Mon Jul 14 12:39:47 GMT 2025","Mon Jul 14 12:39:49 GMT 2025","2107","tests.test_backend.document","test_get_siblings","","","","Проверяем siblins для нескольктих Child (kind=Member)",""
"passed","Mon Jul 14 12:38:41 GMT 2025","Mon Jul 14 12:38:41 GMT 2025","250","tests.test_backend.document","test_get_documents","","","","Негативный кейс: missing kindId",""
"passed","Mon Jul 14 12:34:12 GMT 2025","Mon Jul 14 12:34:12 GMT 2025","285","tests.test_backend.board","board_validation_test","","","","Валидация имени борды: number instead of string → ожидали 400",""
"passed","Mon Jul 14 12:34:20 GMT 2025","Mon Jul 14 12:34:22 GMT 2025","1172","tests.test_backend.board","test_board","","","","Создание нескольких борд с одинаковым именем в одном проекте",""
"passed","Mon Jul 14 12:40:17 GMT 2025","Mon Jul 14 12:40:18 GMT 2025","1389","tests.test_backend.project","test_project","","","","Тест: Проверка slug: уникальность до создания, неуникальность после создания, и ошибка при дубликате",""
"passed","Mon Jul 14 12:40:20 GMT 2025","Mon Jul 14 12:40:20 GMT 2025","481","tests.test_backend.project","test_project","","","","Тест: Проверка получения проекта по ID",""
"passed","Mon Jul 14 12:39:05 GMT 2025","Mon Jul 14 12:39:06 GMT 2025","887","tests.test_backend.document","test_get_siblings","","","","Проверка отсутствия siblins и родителей для одного корневого документа (kind=Member)","Тест проверки siblins и родителей для родительского документа"
"passed","Mon Jul 14 12:39:07 GMT 2025","Mon Jul 14 12:39:10 GMT 2025","2932","tests.test_backend.document","test_get_siblings","","","","Проверяем siblins для нескольких корневых документов (kind=Project)","
    Проверяем сиблинги для нескольких корневых документов (без parent_document_id).
    "
"passed","Mon Jul 14 12:34:44 GMT 2025","Mon Jul 14 12:34:44 GMT 2025","656","tests.test_backend.document.access_doc","test_archive_doc","","","","Архивирование Project-документа для роли manager",""
"passed","Mon Jul 14 12:35:55 GMT 2025","Mon Jul 14 12:35:57 GMT 2025","2288","tests.test_backend.document.access_doc","test_edit_doc_access_by_roles","","","","Редактирование Space-документа: создание owner, редактирование owner",""
"passed","Mon Jul 14 12:35:23 GMT 2025","Mon Jul 14 12:35:24 GMT 2025","1695","tests.test_backend.document.access_doc","test_duplicate_doc_access_by_roles","","","","Дублирование Space-документа: создание owner, дублирование manager",""
"passed","Mon Jul 14 12:35:46 GMT 2025","Mon Jul 14 12:35:47 GMT 2025","939","tests.test_backend.document.access_doc","test_duplicate_doc_access_by_roles","","","","Дублирование Personal-документа: создание member, дублирование owner",""
"passed","Mon Jul 14 12:34:52 GMT 2025","Mon Jul 14 12:34:53 GMT 2025","688","tests.test_backend.document.access_doc","test_create_doc_access_by_roles","","","","Создание Project-документа для роли owner",""
"passed","Mon Jul 14 12:40:19 GMT 2025","Mon Jul 14 12:40:20 GMT 2025","285","tests.test_backend.project","test_project","","","","Тест: Проверка предельной длины описания проекта",""
"passed","Mon Jul 14 12:38:46 GMT 2025","Mon Jul 14 12:38:47 GMT 2025","911","tests.test_backend.document","test_get_documents","","","","Документы разных kind не попадают в результаты других kind",""
"passed","Mon Jul 14 12:34:44 GMT 2025","Mon Jul 14 12:34:45 GMT 2025","677","tests.test_backend.document.access_doc","test_archive_doc","","","","Архивирование Project-документа для роли member",""
"passed","Mon Jul 14 12:40:00 GMT 2025","Mon Jul 14 12:40:00 GMT 2025","765","tests.test_backend.document","test_get_siblings","","","","Негативный: некорректный document_id=None","
    Негативные сценарии: разные варианты некорректного document_id.
    "
"passed","Mon Jul 14 12:35:59 GMT 2025","Mon Jul 14 12:36:01 GMT 2025","2131","tests.test_backend.document.access_doc","test_edit_doc_access_by_roles","","","","Редактирование Space-документа: создание owner, редактирование member",""
"passed","Mon Jul 14 12:36:34 GMT 2025","Mon Jul 14 12:36:37 GMT 2025","2513","tests.test_backend.document.access_doc","test_edit_doc_access_by_roles","","","","Редактирование Project-документа: создание member, редактирование manager",""
"passed","Mon Jul 14 12:35:52 GMT 2025","Mon Jul 14 12:35:53 GMT 2025","972","tests.test_backend.document.access_doc","test_duplicate_doc_access_by_roles","","","","Дублирование Personal-документа: создание guest, дублирование member",""
"passed","Mon Jul 14 12:35:49 GMT 2025","Mon Jul 14 12:35:50 GMT 2025","1106","tests.test_backend.document.access_doc","test_duplicate_doc_access_by_roles","","","","Дублирование Personal-документа: создание member, дублирование guest",""
"passed","Mon Jul 14 12:36:19 GMT 2025","Mon Jul 14 12:36:21 GMT 2025","2082","tests.test_backend.document.access_doc","test_edit_doc_access_by_roles","","","","Редактирование Project-документа: создание owner, редактирование manager",""
"skipped","Mon Jul 14 12:37:35 GMT 2025","Mon Jul 14 12:37:35 GMT 2025","0","tests.test_backend.document","test_create_document","","","","test_document_index_validation[none]",""
"passed","Mon Jul 14 12:40:19 GMT 2025","Mon Jul 14 12:40:19 GMT 2025","252","tests.test_backend.project","test_project","","","","Тест: Проверка предельной длины имени проекта",""
"passed","Mon Jul 14 12:35:06 GMT 2025","Mon Jul 14 12:35:08 GMT 2025","1865","tests.test_backend.document.access_doc","test_duplicate_doc_access_by_roles","","","","Дублирование Project-документа: создание owner, дублирование member",""
"passed","Mon Jul 14 12:34:37 GMT 2025","Mon Jul 14 12:34:38 GMT 2025","1569","tests.test_backend.document.access_doc","test_archive_doc","","","","Архивирование Space-документа для роли owner",""
"passed","Mon Jul 14 12:36:06 GMT 2025","Mon Jul 14 12:36:08 GMT 2025","2024","tests.test_backend.document.access_doc","test_edit_doc_access_by_roles","","","","Редактирование Space-документа: создание manager, редактирование member",""
"passed","Mon Jul 14 12:38:01 GMT 2025","Mon Jul 14 12:38:01 GMT 2025","231","tests.test_backend.document","test_edit_document","","","","Попытка редактировать документ из чужого space (kind=Space)— должен вернуться MemberDidNotFound",""
"passed","Mon Jul 14 12:34:19 GMT 2025","Mon Jul 14 12:34:19 GMT 2025","292","tests.test_backend.board","board_validation_test","","","","APP-2763: Ошибка при создании борды с длинным заголовком custom field: Date",""
"passed","Mon Jul 14 12:37:11 GMT 2025","Mon Jul 14 12:37:14 GMT 2025","2344","tests.test_backend.document.access_doc","test_get_siblings_doc_access","","","","Получение соседей Space-документа для роли owner",""
"passed","Mon Jul 14 12:36:16 GMT 2025","Mon Jul 14 12:36:17 GMT 2025","923","tests.test_backend.document.access_doc","test_edit_doc_access_by_roles","","","","Редактирование Space-документа: создание member, редактирование guest",""
"passed","Mon Jul 14 12:37:33 GMT 2025","Mon Jul 14 12:37:33 GMT 2025","339","tests.test_backend.document","test_create_document","","","","Создание документа — кейс: [html injection] (ожидается 200)",""
"passed","Mon Jul 14 12:37:56 GMT 2025","Mon Jul 14 12:37:57 GMT 2025","293","tests.test_backend.document","test_edit_document","","","","Успешное редактирование полей title и icon. Project",""
"passed","Mon Jul 14 12:37:50 GMT 2025","Mon Jul 14 12:37:51 GMT 2025","717","tests.test_backend.document","test_duplicate_document","","","","Негативный сценарий: дублирование с некорректным documentId, invalid id=None",""
"passed","Mon Jul 14 12:37:29 GMT 2025","Mon Jul 14 12:37:29 GMT 2025","405","tests.test_backend.document","test_create_document","","","","Создание документа: Member",""
"passed","Mon Jul 14 12:37:16 GMT 2025","Mon Jul 14 12:37:19 GMT 2025","2653","tests.test_backend.document.access_doc","test_get_siblings_doc_access","","","","Получение соседей Space-документа для роли member",""
"passed","Mon Jul 14 12:38:18 GMT 2025","Mon Jul 14 12:38:20 GMT 2025","2091","tests.test_backend.document","test_edit_document","","","","Проверка граничной валидации длины title: LENGTH = 2049 for Project",""
"passed","Mon Jul 14 12:34:33 GMT 2025","Mon Jul 14 12:34:33 GMT 2025","628","tests.test_backend.board","test_board","","","","Редактирование кастомного поля типа: Date",""
"passed","Mon Jul 14 12:37:39 GMT 2025","Mon Jul 14 12:37:40 GMT 2025","634","tests.test_backend.document","test_create_document","","","","Создание документа в чужом space",""
"passed","Mon Jul 14 12:37:31 GMT 2025","Mon Jul 14 12:37:31 GMT 2025","275","tests.test_backend.document","test_create_document","","","","Создание документа — кейс: [int as title] (ожидается 400)",""
"passed","Mon Jul 14 12:36:57 GMT 2025","Mon Jul 14 12:36:59 GMT 2025","2232","tests.test_backend.document.access_doc","test_get_docs_list_access_by_roles","","","","Проверка доступа к списку документов в Space для роли member","Проверяем что разные роли могут получить список документов из пространства и проекта"
"passed","Mon Jul 14 12:35:51 GMT 2025","Mon Jul 14 12:35:52 GMT 2025","894","tests.test_backend.document.access_doc","test_duplicate_doc_access_by_roles","","","","Дублирование Personal-документа: создание guest, дублирование manager",""
"passed","Mon Jul 14 12:37:55 GMT 2025","Mon Jul 14 12:37:55 GMT 2025","225","tests.test_backend.document","test_duplicate_document","","","","Авторизован, но не участник пространства — дублирование запрещено Space",""
"passed","Mon Jul 14 12:37:41 GMT 2025","Mon Jul 14 12:37:41 GMT 2025","725","tests.test_backend.document","test_duplicate_document","","","","Создание и дублирование документа (Project)",""
"passed","Mon Jul 14 12:35:00 GMT 2025","Mon Jul 14 12:35:00 GMT 2025","556","tests.test_backend.document.access_doc","test_doc_access_for_foreign","","","","Отказ в доступе к Member документам другим пользователем",""
"passed","Mon Jul 14 12:35:34 GMT 2025","Mon Jul 14 12:35:36 GMT 2025","1304","tests.test_backend.document.access_doc","test_duplicate_doc_access_by_roles","","","","Дублирование Space-документа: создание member, дублирование manager",""
"passed","Mon Jul 14 12:38:06 GMT 2025","Mon Jul 14 12:38:07 GMT 2025","1120","tests.test_backend.document","test_edit_document","","","","Два последовательных запроса на редактирование одного документа- проверяем что последнее изменение сохранилось.Member",""
"passed","Mon Jul 14 12:37:02 GMT 2025","Mon Jul 14 12:37:04 GMT 2025","2592","tests.test_backend.document.access_doc","test_get_docs_list_access_by_roles","","","","Проверка доступа к списку документов в Project для роли owner","Проверяем что разные роли могут получить список документов из пространства и проекта"
"passed","Mon Jul 14 12:38:02 GMT 2025","Mon Jul 14 12:38:02 GMT 2025","220","tests.test_backend.document","test_edit_document","","","","Попытка редактировать документ из чужого space (kind=Member)— должен вернуться MemberDidNotFound",""
"passed","Mon Jul 14 12:34:16 GMT 2025","Mon Jul 14 12:34:16 GMT 2025","285","tests.test_backend.board","board_validation_test","","","","Валидация поля group description: regular description → ожидали 200",""
"passed","Mon Jul 14 12:38:44 GMT 2025","Mon Jul 14 12:38:44 GMT 2025","254","tests.test_backend.document","test_get_documents","","","","Пустой результат при отсутствии документов (kind=Space)",""
"passed","Mon Jul 14 12:36:21 GMT 2025","Mon Jul 14 12:36:24 GMT 2025","2604","tests.test_backend.document.access_doc","test_edit_doc_access_by_roles","","","","Редактирование Project-документа: создание owner, редактирование member",""
"passed","Mon Jul 14 12:40:14 GMT 2025","Mon Jul 14 12:40:14 GMT 2025","314","tests.test_backend.document","test_get_y_document","","","","Негативный экспорт Y-Doc для document_id=000000000000000000000000","
    Негативный сценарий: разные некорректные document_id.
    "
"passed","Mon Jul 14 12:40:02 GMT 2025","Mon Jul 14 12:40:04 GMT 2025","2072","tests.test_backend.document","test_get_siblings","","","","Негативный сценарий: гостевой пользователь не может получить siblings (kind=Project)",""
"passed","Mon Jul 14 12:37:33 GMT 2025","Mon Jul 14 12:37:34 GMT 2025","766","tests.test_backend.document","test_create_document","","","","Создание документа — кейс: [special chars] (ожидается 200)",""
"passed","Mon Jul 14 12:38:44 GMT 2025","Mon Jul 14 12:38:46 GMT 2025","1482","tests.test_backend.document","test_get_documents","","","","Project: изолированность документов по kindId проектов",""
"passed","Mon Jul 14 12:38:00 GMT 2025","Mon Jul 14 12:38:01 GMT 2025","228","tests.test_backend.document","test_edit_document","","","","Попытка редактировать документ из чужого space (kind=Project)— должен вернуться MemberDidNotFound",""
"passed","Mon Jul 14 12:40:23 GMT 2025","Mon Jul 14 12:40:23 GMT 2025","212","tests.test_backend.space","test_space","","","","Test space name cannot be empty",""
"passed","Mon Jul 14 12:34:32 GMT 2025","Mon Jul 14 12:34:33 GMT 2025","650","tests.test_backend.board","test_board","","","","Редактирование кастомного поля типа: Boolean",""
"passed","Mon Jul 14 12:34:57 GMT 2025","Mon Jul 14 12:34:57 GMT 2025","592","tests.test_backend.document.access_doc","test_create_doc_access_by_roles","","","","Создание Personal-документа для роли guest",""
"passed","Mon Jul 14 12:37:59 GMT 2025","Mon Jul 14 12:37:59 GMT 2025","256","tests.test_backend.document","test_edit_document","","","","Негативные сценарии: некорректный documentId. id=",""
"passed","Mon Jul 14 12:34:29 GMT 2025","Mon Jul 14 12:34:29 GMT 2025","663","tests.test_backend.board","test_board","","","","Создание кастомного поля типа: Boolean",""
"passed","Mon Jul 14 12:34:52 GMT 2025","Mon Jul 14 12:34:52 GMT 2025","575","tests.test_backend.document.access_doc","test_create_doc_access_by_roles","","","","Создание Space-документа для роли member",""
"passed","Mon Jul 14 12:36:04 GMT 2025","Mon Jul 14 12:36:06 GMT 2025","2075","tests.test_backend.document.access_doc","test_edit_doc_access_by_roles","","","","Редактирование Space-документа: создание manager, редактирование manager",""
"passed","Mon Jul 14 12:38:53 GMT 2025","Mon Jul 14 12:38:57 GMT 2025","4319","tests.test_backend.document","test_get_documents","","","","Сортировка документов по createdAt (kind=Space)",""
"passed","Mon Jul 14 12:37:34 GMT 2025","Mon Jul 14 12:37:35 GMT 2025","1108","tests.test_backend.document","test_create_document","","","","Создание дочерних документов, Проверка status_code и title",""
"passed","Mon Jul 14 12:40:16 GMT 2025","Mon Jul 14 12:40:17 GMT 2025","566","tests.test_backend.document","test_get_y_document","","","","Попытка экспортировать Y-Doc из чужого space(kind=Member)— должен вернуться SpaceIdNotSpecified"," "
"passed","Mon Jul 14 12:35:26 GMT 2025","Mon Jul 14 12:35:27 GMT 2025","1138","tests.test_backend.document.access_doc","test_duplicate_doc_access_by_roles","","","","Дублирование Space-документа: создание owner, дублирование guest",""
"passed","Mon Jul 14 12:38:47 GMT 2025","Mon Jul 14 12:38:47 GMT 2025","210","tests.test_backend.document","test_get_documents","","","","Запрос документов с kind=Member, но с чужим spaceId",""
"passed","Mon Jul 14 12:34:17 GMT 2025","Mon Jul 14 12:34:17 GMT 2025","292","tests.test_backend.board","board_validation_test","","","","Валидация поля limit для board group: 1000",""
"passed","Mon Jul 14 12:35:08 GMT 2025","Mon Jul 14 12:35:10 GMT 2025","1343","tests.test_backend.document.access_doc","test_duplicate_doc_access_by_roles","","","","Дублирование Project-документа: создание owner, дублирование guest",""
