"Status","Start Time","Stop Time","Duration in ms","Parent Suite","Suite","Sub Suite","Test Class","Test Method","Name","Description"
"passed","Mon Jul 14 13:44:13 GMT 2025","Mon Jul 14 13:44:16 GMT 2025","3267","tests.test_backend.document","test_edit_document","","","","Проверка граничной валидации длины title: LENGTH = 2048 for Member",""
"passed","Mon Jul 14 13:42:17 GMT 2025","Mon Jul 14 13:42:21 GMT 2025","3886","tests.test_backend.document.access_doc","test_edit_doc_access_by_roles","","","","Редактирование Space-документа: создание owner, редактирование manager",""
"passed","Mon Jul 14 13:45:00 GMT 2025","Mon Jul 14 13:45:00 GMT 2025","683","tests.test_backend.document.access_doc","test_get_docs_list_access_by_roles","","","","Проверка доступа к personal документам для роли guest","Проверяем что пользователи могут получить только свои personal документы"
"failed","Mon Jul 14 13:44:16 GMT 2025","Mon Jul 14 13:44:16 GMT 2025","266","tests.test_backend.document.access_doc","test_archive_doc","","","","Архивирование Personal-документа для роли manager, документ создан в роли Member",""
"passed","Mon Jul 14 13:42:50 GMT 2025","Mon Jul 14 13:42:52 GMT 2025","1875","tests.test_backend.document.access_doc","test_duplicate_doc_access_by_roles","","","","Дублирование Space-документа: создание owner, дублирование guest",""
"passed","Mon Jul 14 13:42:50 GMT 2025","Mon Jul 14 13:42:51 GMT 2025","1347","tests.test_backend.board","test_board","","","","Редактирование кастомного поля типа: Boolean",""
"passed","Mon Jul 14 13:43:16 GMT 2025","Mon Jul 14 13:43:19 GMT 2025","2654","tests.test_backend.document.access_doc","test_edit_doc_access_by_roles","","","","Редактирование Project-документа: создание manager, редактирование guest",""
"passed","Mon Jul 14 13:43:32 GMT 2025","Mon Jul 14 13:43:33 GMT 2025","819","tests.test_backend.document.access_doc","test_edit_doc_access_by_roles","","","","Редактирование Personal-документа: создание owner, редактирование manager",""
"passed","Mon Jul 14 13:43:46 GMT 2025","Mon Jul 14 13:43:46 GMT 2025","291","tests.test_backend.document","test_get_document","","","","Негативный кейс: documentId=123",""
"passed","Mon Jul 14 13:43:42 GMT 2025","Mon Jul 14 13:43:43 GMT 2025","475","tests.test_backend.document","test_edit_document","","","","Успешное редактирование полей title и icon. Member",""
"passed","Mon Jul 14 13:42:40 GMT 2025","Mon Jul 14 13:42:42 GMT 2025","2225","tests.test_backend.document.access_doc","test_duplicate_doc_access_by_roles","","","","Дублирование Project-документа: создание member, дублирование manager",""
"passed","Mon Jul 14 13:43:20 GMT 2025","Mon Jul 14 13:43:20 GMT 2025","425","tests.test_backend.document","test_get_documents","","","","Несоответствие kind и kindId — kind=Member с kindId от Project",""
"passed","Mon Jul 14 13:42:40 GMT 2025","Mon Jul 14 13:42:42 GMT 2025","1822","tests.test_backend.document","test_get_siblings","","","","Проверка отсутствия siblins и родителей для одного корневого документа (kind=Member)","Тест проверки siblins и родителей для родительского документа"
"passed","Mon Jul 14 13:42:48 GMT 2025","Mon Jul 14 13:42:49 GMT 2025","646","tests.test_backend.board","test_board","","","","Редактирование кастомного поля типа: Text",""
"passed","Mon Jul 14 13:44:36 GMT 2025","Mon Jul 14 13:44:37 GMT 2025","836","tests.test_backend.document","test_duplicate_document","","","","Негативный сценарий: дублирование с некорректным documentId, invalid id=None",""
"passed","Mon Jul 14 13:44:16 GMT 2025","Mon Jul 14 13:44:17 GMT 2025","817","tests.test_backend.document.access_doc","test_archive_doc","","","","Архивирование Personal-документа для роли guest, документ создан в роли Member",""
"passed","Mon Jul 14 13:44:17 GMT 2025","Mon Jul 14 13:44:20 GMT 2025","3002","tests.test_backend.document","test_get_y_document","","","","Позитивный сценарий: успешный экспорт Y-Doc для документа. Project",""
"passed","Mon Jul 14 13:42:46 GMT 2025","Mon Jul 14 13:42:47 GMT 2025","484","tests.test_backend.board","test_board","","","","Создание кастомного поля типа: Date",""
"passed","Mon Jul 14 13:43:31 GMT 2025","Mon Jul 14 13:43:33 GMT 2025","1156","tests.test_backend.document.access_doc","test_duplicate_doc_access_by_roles","","","","Дублирование Personal-документа: создание member, дублирование member",""
"passed","Mon Jul 14 13:44:14 GMT 2025","Mon Jul 14 13:44:16 GMT 2025","1985","tests.test_backend.document","test_get_siblings","","","","Негативный сценарий: гостевой пользователь не может получить siblings (kind=Space)",""
"passed","Mon Jul 14 13:44:23 GMT 2025","Mon Jul 14 13:44:24 GMT 2025","303","tests.test_backend.document","test_get_y_document","","","","Негативный экспорт Y-Doc для document_id=","
    Негативный сценарий: разные некорректные document_id.
    "
"passed","Mon Jul 14 13:43:27 GMT 2025","Mon Jul 14 13:43:28 GMT 2025","1123","tests.test_backend.document.access_doc","test_duplicate_doc_access_by_roles","","","","Дублирование Personal-документа: создание manager, дублирование guest",""
"passed","Mon Jul 14 13:42:18 GMT 2025","Mon Jul 14 13:42:19 GMT 2025","681","tests.test_backend.document","test_create_document","","","","Создание документа — кейс: [title = MAX length (2048)] (ожидается 200)",""
"passed","Mon Jul 14 13:43:14 GMT 2025","Mon Jul 14 13:43:15 GMT 2025","1061","tests.test_backend.document","test_get_documents","","","","Документы разных kind не попадают в результаты других kind",""
"passed","Mon Jul 14 13:42:28 GMT 2025","Mon Jul 14 13:42:28 GMT 2025","487","tests.test_backend.board","board_validation_test","","","","APP-2763: Ошибка при создании борды с длинным заголовком custom field: Select",""
"passed","Mon Jul 14 13:42:22 GMT 2025","Mon Jul 14 13:42:23 GMT 2025","594","tests.test_backend.document","test_create_document","","","","Создание документа — кейс: [html injection] (ожидается 200)",""
"passed","Mon Jul 14 13:42:25 GMT 2025","Mon Jul 14 13:42:27 GMT 2025","2361","tests.test_backend.document.access_doc","test_edit_doc_access_by_roles","","","","Редактирование Space-документа: создание owner, редактирование guest",""
