"Status","Start Time","Stop Time","Duration in ms","Parent Suite","Suite","Sub Suite","Test Class","Test Method","Name","Description"
"passed","Tue Jul 15 08:27:01 GMT 2025","Tue Jul 15 08:27:02 GMT 2025","1401","tests.test_backend.document.access_doc","test_duplicate_doc_access_by_roles","","","","Дублирование Personal-документа: создание owner, дублирование guest",""
"passed","Tue Jul 15 08:28:08 GMT 2025","Tue Jul 15 08:28:13 GMT 2025","4948","tests.test_backend.document","test_get_documents","","","","Сортировка документов по createdAt (kind=Member)",""
"passed","Tue Jul 15 08:27:26 GMT 2025","Tue Jul 15 08:27:26 GMT 2025","368","tests.test_backend.document","test_create_document","","","","Создание документа без авторизации",""
"passed","Tue Jul 15 08:29:28 GMT 2025","Tue Jul 15 08:29:29 GMT 2025","544","tests.test_backend.document","test_get_y_document","","","","Позитивный сценарий: успешный экспорт Y-Doc для документа. Member",""
"passed","Tue Jul 15 08:27:33 GMT 2025","Tue Jul 15 08:27:33 GMT 2025","273","tests.test_backend.board","board_validation_test","","","","APP-2763: Ошибка при создании борды с длинным заголовком custom field: Member",""
"passed","Tue Jul 15 08:27:28 GMT 2025","Tue Jul 15 08:27:29 GMT 2025","761","tests.test_backend.board","test_board","","","","Создание борды в существующем проекте и корректность возвращаемого имени",""
"passed","Tue Jul 15 08:27:27 GMT 2025","Tue Jul 15 08:27:28 GMT 2025","615","tests.test_backend.board","board_validation_test","","","","Валидация поля group description: max valid (1024 chars) → ожидали 200",""
"passed","Tue Jul 15 08:28:50 GMT 2025","Tue Jul 15 08:28:51 GMT 2025","704","tests.test_backend.project","test_project","","","","Тест: Проверка предельной длины имени проекта",""
"passed","Tue Jul 15 08:27:12 GMT 2025","Tue Jul 15 08:27:13 GMT 2025","772","tests.test_backend.document.access_doc","test_edit_doc_access_by_roles","","","","Редактирование Personal-документа: создание manager, редактирование owner",""
"passed","Tue Jul 15 08:29:25 GMT 2025","Tue Jul 15 08:29:25 GMT 2025","192","tests.test_backend.document","test_duplicate_document","","","","Авторизован, но не участник пространства — дублирование запрещено Project",""
"passed","Tue Jul 15 08:27:30 GMT 2025","Tue Jul 15 08:27:31 GMT 2025","351","tests.test_backend.board","board_validation_test","","","","Валидация поля limit для board group: 999",""
"passed","Tue Jul 15 08:26:57 GMT 2025","Tue Jul 15 08:26:59 GMT 2025","1971","tests.test_backend.document.access_doc","test_edit_doc_access_by_roles","","","","Редактирование Project-документа: создание manager, редактирование manager",""
"passed","Tue Jul 15 08:29:18 GMT 2025","Tue Jul 15 08:29:19 GMT 2025","1022","tests.test_backend.document","test_duplicate_document","","","","Негативный сценарий: дублирование с некорректным documentId, invalid id=",""
"passed","Tue Jul 15 08:26:46 GMT 2025","Tue Jul 15 08:26:49 GMT 2025","2383","tests.test_backend.document.access_doc","test_edit_doc_access_by_roles","","","","Редактирование Project-документа: создание owner, редактирование owner",""
"passed","Tue Jul 15 08:29:38 GMT 2025","Tue Jul 15 08:29:41 GMT 2025","3177","tests.test_backend.space","test_space","","","","Test remove space success",""
"passed","Tue Jul 15 08:27:58 GMT 2025","Tue Jul 15 08:28:00 GMT 2025","2453","tests.test_backend.document","test_get_siblings","","","","Проверяем глубокую вложенность для Grandchild = [root_id, parent_id, child_id] (kind=Space)","
    Глубокая вложенность: проверяем цепочку parents.
    "
"passed","Tue Jul 15 08:26:38 GMT 2025","Tue Jul 15 08:26:40 GMT 2025","2115","tests.test_backend.document.access_doc","test_duplicate_doc_access_by_roles","","","","Дублирование Project-документа: создание member, дублирование member",""
"passed","Tue Jul 15 08:29:27 GMT 2025","Tue Jul 15 08:29:28 GMT 2025","836","tests.test_backend.document.access_doc","test_get_docs_list_access_by_roles","","","","Проверка доступа к personal документам для роли owner","Проверяем что пользователи могут получить только свои personal документы"
"passed","Tue Jul 15 08:29:33 GMT 2025","Tue Jul 15 08:29:34 GMT 2025","584","tests.test_backend.document.access_doc","test_doc_access_for_foreign","","","","Отказ в доступе к Project документам другим пользователем",""
"passed","Tue Jul 15 08:29:35 GMT 2025","Tue Jul 15 08:29:36 GMT 2025","557","tests.test_backend.document.access_doc","test_doc_access_for_foreign","","","","Попытка получить документ из чужого space (kind=Member) — должен вернуться AccessDenied",""
"passed","Tue Jul 15 08:29:34 GMT 2025","Tue Jul 15 08:29:34 GMT 2025","173","tests.test_backend.document.access_doc","test_doc_access_for_foreign","","","","Отказ в доступе к Member документам другим пользователем",""
"passed","Tue Jul 15 08:29:30 GMT 2025","Tue Jul 15 08:29:30 GMT 2025","299","tests.test_backend.document","test_get_y_document","","","","Негативный экспорт Y-Doc для document_id=bad_format","
    Негативный сценарий: разные некорректные document_id.
    "
"passed","Tue Jul 15 08:29:34 GMT 2025","Tue Jul 15 08:29:34 GMT 2025","297","tests.test_backend.document.access_doc","test_doc_access_for_foreign","","","","Отказ в доступе к Space документам другим пользователем",""
"passed","Tue Jul 15 08:29:00 GMT 2025","Tue Jul 15 08:29:01 GMT 2025","1126","tests.test_backend.document.access_doc","test_archive_doc","","","","Архивирование Personal-документа для роли owner, документ создан в роли Member",""
"passed","Tue Jul 15 08:28:42 GMT 2025","Tue Jul 15 08:28:43 GMT 2025","1744","tests.test_backend.document","test_get_siblings","","","","Негативный сценарий: гостевой пользователь не может получить siblings (kind=Space)",""
"passed","Tue Jul 15 08:27:54 GMT 2025","Tue Jul 15 08:27:55 GMT 2025","313","tests.test_backend.document","test_get_documents","","","","Пустой результат при отсутствии документов (kind=Space)",""
"passed","Tue Jul 15 08:28:51 GMT 2025","Tue Jul 15 08:28:52 GMT 2025","533","tests.test_backend.project","test_project","","","","Тест: Проверка получения проекта по ID",""
