"Status","Start Time","Stop Time","Duration in ms","Parent Suite","Suite","Sub Suite","Test Class","Test Method","Name","Description"
"passed","Tue Jul 08 07:18:56 GMT 2025","Tue Jul 08 07:18:56 GMT 2025","613","tests.test_backend.document.access_doc","test_create_and_archive_doc_access_by_roles","","","","Создание Space-документа для роли manager",""
"passed","Tue Jul 08 07:20:32 GMT 2025","Tue Jul 08 07:20:32 GMT 2025","499","tests.test_backend.document","test_get_documents","","","","Пустой результат при отсутствии документов (kind=Member)",""
"passed","Tue Jul 08 07:18:42 GMT 2025","Tue Jul 08 07:18:42 GMT 2025","535","tests.test_backend.board","test_board","","","","Редактирование кастомного поля типа: Text",""
"passed","Tue Jul 08 07:18:45 GMT 2025","Tue Jul 08 07:18:46 GMT 2025","523","tests.test_backend.board","test_board","","","","Редактирование поля Select: добавление новых опций с валидным _id",""
"passed","Tue Jul 08 07:18:31 GMT 2025","Tue Jul 08 07:18:32 GMT 2025","274","tests.test_backend.board","board_validation_test","","","","Валидация поля limit для board group: 123",""
"passed","Tue Jul 08 07:21:46 GMT 2025","Tue Jul 08 07:21:47 GMT 2025","262","tests.test_backend.project","test_project","","","","Тест: Проверка предельной длины описания проекта",""
"passed","Tue Jul 08 07:21:40 GMT 2025","Tue Jul 08 07:21:41 GMT 2025","358","tests.test_backend.document","test_get_y_document","","","","Негативный экспорт Y-Doc для document_id=000000000000000000000000","
    Негативный сценарий: разные некорректные document_id.
    "
"passed","Tue Jul 08 07:18:33 GMT 2025","Tue Jul 08 07:18:34 GMT 2025","282","tests.test_backend.board","test_board","","","","Создание борды в существующем проекте и корректность возвращаемого имени",""
"passed","Tue Jul 08 07:19:25 GMT 2025","Tue Jul 08 07:19:26 GMT 2025","365","tests.test_backend.document.access_doc","test_get_siblings_doc_access","","","","Получение соседей Space-документа для роли guest",""
"passed","Tue Jul 08 07:21:03 GMT 2025","Tue Jul 08 07:21:05 GMT 2025","2088","tests.test_backend.document","test_get_siblings","","","","Проверяем глубокую вложенность для Grandchild = [root_id, parent_id, child_id] (kind=Project)","
    Глубокая вложенность: проверяем цепочку parents.
    "
"passed","Tue Jul 08 07:20:35 GMT 2025","Tue Jul 08 07:20:35 GMT 2025","213","tests.test_backend.document","test_get_documents","","","","Запрос документов с kind=Space, но с чужим spaceId",""
"passed","Tue Jul 08 07:19:37 GMT 2025","Tue Jul 08 07:19:37 GMT 2025","283","tests.test_backend.document","test_create_document","","","","Создание документа — кейс: [title = MAX length (2048)] (ожидается 200)",""
"passed","Tue Jul 08 07:20:36 GMT 2025","Tue Jul 08 07:20:40 GMT 2025","4173","tests.test_backend.document","test_get_documents","","","","Сортировка документов по createdAt (kind=Project)",""
"passed","Tue Jul 08 07:19:35 GMT 2025","Tue Jul 08 07:19:36 GMT 2025","600","tests.test_backend.document","test_create_document","","","","Создание документа — кейс: [None] (ожидается 200)",""
"passed","Tue Jul 08 07:19:37 GMT 2025","Tue Jul 08 07:19:37 GMT 2025","244","tests.test_backend.document","test_create_document","","","","Создание документа — кейс: [title > MAX length (2049)] (ожидается 400)",""
"passed","Tue Jul 08 07:21:16 GMT 2025","Tue Jul 08 07:21:18 GMT 2025","1379","tests.test_backend.document","test_get_siblings","","","","Проверяем siblins для единственного SoloChild (kind=Member)","
    Единственный ребёнок: нет prevSibling/nextSibling, parents содержит родителя.
    "
"passed","Tue Jul 08 07:19:38 GMT 2025","Tue Jul 08 07:19:38 GMT 2025","338","tests.test_backend.document","test_create_document","","","","Создание документа — кейс: [cyrillic] (ожидается 200)",""
"passed","Tue Jul 08 07:18:26 GMT 2025","Tue Jul 08 07:18:26 GMT 2025","242","tests.test_backend.board","board_validation_test","","","","Валидация имени борды: number instead of string → ожидали 400",""
"passed","Tue Jul 08 07:20:19 GMT 2025","Tue Jul 08 07:20:19 GMT 2025","534","tests.test_backend.document","test_get_document","","","","Успешное получение документа по documentId (kind=Project)",""
"passed","Tue Jul 08 07:20:29 GMT 2025","Tue Jul 08 07:20:29 GMT 2025","252","tests.test_backend.document","test_get_documents","","","","Негативный кейс: missing kind",""
"passed","Tue Jul 08 07:19:23 GMT 2025","Tue Jul 08 07:19:25 GMT 2025","2027","tests.test_backend.document.access_doc","test_get_siblings_doc_access","","","","Получение соседей Space-документа для роли member",""
"passed","Tue Jul 08 07:19:16 GMT 2025","Tue Jul 08 07:19:17 GMT 2025","1140","tests.test_backend.document.access_doc","test_get_docs_list_access_by_roles","","","","Получение списка Space-документов для роли manager",""
"passed","Tue Jul 08 07:19:57 GMT 2025","Tue Jul 08 07:19:58 GMT 2025","250","tests.test_backend.document","test_edit_document","","","","Негативные сценарии: некорректный documentId. id=None",""
"passed","Tue Jul 08 07:20:22 GMT 2025","Tue Jul 08 07:20:23 GMT 2025","508","tests.test_backend.document","test_get_document","","","","Попытка получить документ из чужого space (kind=Space) — должен вернуться AccessDenied",""
"passed","Tue Jul 08 07:18:37 GMT 2025","Tue Jul 08 07:18:38 GMT 2025","235","tests.test_backend.board","test_board","","","","Ошибка при попытке получить борду по несуществующему boardId",""
"passed","Tue Jul 08 07:19:38 GMT 2025","Tue Jul 08 07:19:38 GMT 2025","241","tests.test_backend.document","test_create_document","","","","Создание документа — кейс: [list as title] (ожидается 400)",""
"passed","Tue Jul 08 07:20:24 GMT 2025","Tue Jul 08 07:20:25 GMT 2025","770","tests.test_backend.document","test_get_document","","","","Повторный запрос одного и того же документа (kind=Space)",""
"passed","Tue Jul 08 07:20:45 GMT 2025","Tue Jul 08 07:20:49 GMT 2025","4142","tests.test_backend.document","test_get_documents","","","","Сортировка документов по createdAt (kind=Member)",""
"passed","Tue Jul 08 07:18:36 GMT 2025","Tue Jul 08 07:18:37 GMT 2025","1069","tests.test_backend.board","test_board","","","","Получение списка борд: проверка созданных борд и их обязательных полей(name, projectId, createdAt)",""
"passed","Tue Jul 08 07:21:50 GMT 2025","Tue Jul 08 07:21:52 GMT 2025","1943","tests.test_backend.space","test_space","","","","Test remove space success",""
"passed","Tue Jul 08 07:20:35 GMT 2025","Tue Jul 08 07:20:35 GMT 2025","208","tests.test_backend.document","test_get_documents","","","","Запрос документов с kind=Member, но с чужим spaceId",""
"passed","Tue Jul 08 07:18:26 GMT 2025","Tue Jul 08 07:18:26 GMT 2025","259","tests.test_backend.board","board_validation_test","","","","Валидация имени борды: length > 50 → ожидали 400",""
"passed","Tue Jul 08 07:18:30 GMT 2025","Tue Jul 08 07:18:31 GMT 2025","262","tests.test_backend.board","board_validation_test","","","","Валидация поля limit для board group: 999",""
"passed","Tue Jul 08 07:21:33 GMT 2025","Tue Jul 08 07:21:34 GMT 2025","1516","tests.test_backend.document","test_get_siblings","","","","Негативный сценарий: гостевой пользователь не может получить siblings (kind=Project)",""
"skipped","Tue Jul 08 07:19:40 GMT 2025","Tue Jul 08 07:19:40 GMT 2025","0","tests.test_backend.document","test_create_document","","","","test_document_index_validation[too large]",""
